Message,Reply
"You wanna play padel at 12ish?
Don't stress if you can't fit it in though","Yeah sorry Dan I don’t think I’m going to be able to
Sorry for saying no to everything, just a little caught up with work at the moment
If you guys plan on paying anytime next week I’ll be free"
"Are you free to play paddle at 5pm today?
No pressure if not",Sounds good 
Kian pretty much confirmed with 90% certainty that he will be going back to Joburg next year so I think we just assume we are looking for a 2 bedroom place,"Ok damn
Fair enough"
https://m.chaseveritt.co.za/results/residential/to-let/stellenbosch/onder-papegaaiberg/apartment/4192203/,Did you message the lady?
I'm happy to chat tomorrow if that's better for you,Oh shit sorry I think my phone is acting up. It didn’t show your message. I can come now?
"No stress, yes you can",Ok cool I’ll come in 5 mins
Cool,How’d the essay go?
Not the greatest but at least it's done now,What other work do you have now? Or just exams coming up now ?
"What time is Jono gonna get here?
Yeah that works
Maybe slightly before even if we also have to stop past kian","Okay I’ve asked him
I’m gonna go wait outside"
Are you gonna be home at 4:40 pm today? Cause I've got a checkers order coming then and wondering if you can help me bring it in,"I think I might get home just after then. I have a class now sorry
I’ll let you know if I do end up finishing earlier"
"Don't stress if you're not here
Don't stress about rushing home he arrived early and I got all my stuff",Oh okay sorry just got back now
My driver should be here in about 5 minutes if you're free. Don't stress if you cant,"Shit forgot to respond
Yes I’m here now
Did I miss it?"
Kian is having a braai now if you and Faith want to join. No pressure but if you're wanting a small break from studying you're welcome to join,Thank Dan but won’t join today. Just got a little too much work to catch up on. Enjoy !
"Also bring a hoodie or jacket with as well cause the bib can get a bit chilly at times
And you will need your student card of course
Cool",You want to walk or drive?
Walk if you're good with that?,Yeah I am
You ready?,Yeah
Cool,It is kians birthday right ?
Goodluck for your exam tomorrow,How’s your work going?
"Not that great unfortunately, nothing is really sticking","Shit sorry to hear that
Do you want steers or something ?
I’m free so I can go get you some stuff to help studying"
Don't stress I got a checkets order earlier so have food but thanks for offering,Goodluck for the paper Dan
Thanks Nic,Hope the exam goes well
"Thanks
How's your studying been?",But it’s going okay thanks
"How was your exam this week
You gonna come to Kians today?","I got the dates wrong 
I assume you are too?"
You want to head to kians together?,What time is it?
Kian said from 3,"Damn
Not gonna be ready by then
We’ll come a little later"
"Cool
We gonna head to tops now, you guys want anything?
Cool",Not gonna be coming to aanklaas
No stress,How was last night?
"You gonna be home in like 45ish minutes? Cause I'm getting a checkers order
He's on his way noe and will be here in 5ish minutes if you can help","Oh sorry was playing tennis
On way back now"
"Cool, I think he actually hasn't left yet so will still be a few minutes","Ok cool
I’ll be back then
Theres a checkers guy outside
Might be yours"
How was your exam?,Was as good as it could have been thanks
You keen to watch the rugby at kians later for a little break?,Enjoy it
"How was your exam today?
Also when do you finish tomorrow? Cause we could try play padel after?","I’m only finishing after 5
Are they open after that?"
"We're at the steers now
Will tell you when we are back","Sorry just got back from checkers and we are gonna have a movie night tonight so won’t join
Enjoy beers and steers"
"No stress,  enjoy",You ready?
Can you send the details of the cleaning company you found?,"Sweep south
Can get their app
What time are the beds getting collected
Tomorrow"
"Yeah I will if that's ok?
I just checked a flight tracker and it seems like mom's flight might also arrive early
At like 9:20",What time you think we should leave here
"I think at like 20 to 9 if that works?
Maybe even 15 to 9
Knowing mom she might also go to the woollies though","Maybe around 9 ish
?"
"Id say like 8:55?
Does that work?","I might be a little late
Going to have to fill up with petrol"
"No stress then
Just let me know when you finish so I can get ready
Or are you saying we leave here at like 8:55 and then go fill up with petrol?","Can you bring tissues
Or toilet paper"
"Yeah
You outside?",Yeah
If its possible could you bring the screw driver if it's there by Faths place. No stress if it's not,Got one
"Sweep South sent me an invoice for the cleaning on the 30th, so just check your emails and send Cindy a screenshot",Ok cool thanks
"I'll be out soon, just gonna brush my teeth","Can you ask kev to pick us up
Mom needs the car"
You still gonna go through to the kitchen or lounge or can I lock up?,"I don’t think I’m gonna come to Kevin’s with you
Got a pretty bad headache"
How are you feeling after your surgery?,How’s china?
"But I could definitely do with a bit more sleep and a bit less food 
How are you feeling from the surgery currently? Still fine?",How’s dalian?
"Got the bamboo one
Apparently you can't share the picture I sent of the bamboo though cause its an early release
Just so you know ","Sounds good
Let me know how much I owe you"
"Also what do you want to get Dad for Christmas? Cause maybe we could order him something of Takelot
I couldn't think of anything big to get him here. I did get him a white rabbit sweet pack with about 8 different white rabbit flavours that can be part of it from both of us though",Same headphones as mine
You guys keen to play padel at 11am at glendower tomorrow?,Yeah sounds good
You cool if we leave here at just before 9?,"Might be a tiny bit late
But yes"
As in I'll be late or you'll be a bit late for something?,No might not be ready to leave by before 9
Cool that's fine,Okay cool cool
Noones on the toilet and I can come out to the lounge?,Yeah
Or anytime later is fine too,"Shoot sorry the message didn’t come through
Yes we still at dinner
Leaving soon
Will pick you up after dropping everyone off"
"Cool, no rush here","Leaving mom and dads now
1 min away"
Cool coming down,Let me know when you up
"I'm up
Take it you need to get something from here?",Yeah I just want to get my clothes for gym
You must still pay your court fee,Done
What time are you guys going to sleep?,"Probably soonish why?
What’s your plans?"
I'll probably uber back now if you're ok to stay up a bit and let me back in?,Yeah sure
"Cool, calling one now from kian
My face will still work on the gate right?","Erm
Let me ask faith
Yes if you go through the pedestrian gate"
Thanks again for dropping me off and letting me stay there. I really appreciate it,"Of course, anytime"
Thanks for not ratting me out to mom and dad on the call ,"You’re welcome 
How’d it go?"
Why did you bring the giant chocolate bunny to kians ,"lol
Saw it at spar on the way there and couldn’t not
Classic Chinese hotpot desert"
I finally let mom and dad know about Kelly now ,"How’d they take it??
How’s things with you and her ? Still good?"
"You guys happy with getting the kitten?
She's very cute",How was the concert?
You guys still enjoying your kitten as much?,"Definitely
She’s been so cool to have
Stress reliever
How’re you and kelly doing? Heard she’s meeting mom and dad this weekend… how you feeling about that?"
"How's your work been going?
How's Nala been?",How’ve you been recently?
"You home to do a short call about dad's birthday?
These are some of the pics I took a bit ago","Jeez that looks lekker
Nice job"
Can I call now?,At gym at the moment but I’ll call as soon as I’m done?
"Thank you
Whats your email address?",nicholas.mosb@gmail.com
"Hi Nic, any chance we could move today lesson to tomorrow evening?","Yeah that works for me, same time tmrw?"
Cool if we start at 5:15pm?,Yeah of course
Hey Nic can we schedule our next lesson for the 15th of May at 9am?,Sorry was a accident 
All good,"On Wednesday, could we do chapter 6? And then cover jacobian transformation where U has different pdf equations over different intervals. I have an example of one if you need"
"Hi Nic, still completely out of it
Can we do a double on Tuesday and a double on Wednesday. That way you can get answers to all your questions before the A2
I know its not ideal so alternatively I can arrange for one of my buddies to take you for a lesson or two before that date aswell if you would like","No no that works actually would be nice doing it right before as a revision type thing. Sorry you still not feeling good, hope you start feeling better soon!"
"Thanks, ok perfect. See you on Tuesday and Wednesday",I’m writing comp sci at 14:00 tomorrow. I’m free the rest of the day. What time works best for you?
Hi Nic will 8-10pm work,"On Wednesday could we do error estimation. Mainly just on crude error of estimation bound
And then an example or 2 of binomial approximation. I’m struggling to identify which approximation to use between the 2 options"
"Hi Nic, I havent had a chance to look at the questions you wanted",Yeah that works
Check you at 5pm again?,Sounds good
Im going to find examples of approximation for normal and binomial by tonight. Ill write them out on my iPad and send it to you on pdf rather than doing the lesson at 5pm. Will try my best to send it through by tonight,"Nah no stress. I understand the binomial approximation now. The only thing I really am not sure of is random variable transformations where u splits into more than one eqn.
I’ll try find an example and then even if we don’t do a call, could you answer the question and explain how you determine if it needs to be separated? If not no stress"
Ill try ny best to get it to you by tonight or latest before 6am tomorrow,"I got that 1/2 < u < 1 but not sure how they got 0 < u< 1/2 and why they’re seperate
If that makes sense?"
"put the hashtable into testsy....
Don't run em in narga",Thank you!!!
"Hi Nicholas Mostert, thank you for your enquiry regarding the property in Nuutgevonden. https://www.property24.com/to-rent/nuutgevonden/stellenbosch/western-cape/14263/115381393
Hi Nicholas ","Morning,"
Sure will call you,Thank you!
https://youtube.com/shorts/q01zpa6Dnfc?si=wO68E4uF7AvhutyG,New fear
Howzit bro. Kian is injured but I was wondering if you wanted to play some tennis today?,"Yeah I’m down
What time you thinking?"
I would think 6 or 7 At van der stel? What do you think?,"6 sounds good 
Is it chilled if I use your spare racket?"
Yeah sure bro. The one that’s the same as Kians?,"Yeah anyone is fine
Thanks Chris"
"I made it sir
Must I pick you up later?",Nah no stress I’ll meet you there
"Do you have new balls by any chance?
Or are we going to use my dog balls",I’m gonna buy some new balls probably this week
"Uhg it should be fine
I’m here","it looks sick
well done
very interesting"
Thanks bro,I’m here
Hey bro,"You still keen? Weather looks a bit dodge
I’m down though"
"Yeah bro I’m keen
How was your test?","How was the presentation??
Sounds good 
Kian gonna play?"
"His wrist is sore
So I don’t think so. I asked him last night already","Kians down
Can we book for three people?
At the indoor"
Unfortunately not,You rate we could book and then all show up?
What do you think?,"The court is a double court right
Yeah I rate we try"
"Okidoki
What timeb
6?","I’d rather do sooner rather than later
You still want to do 4?
Shit sorry my phone is acting up
Couldn’t answer
What time you ratev"
Hey bro,Sorry bro I’m writing tmrw and am pretty busy today so can’t play
Hey Nic! Are you back in stellies?,You down to play tennis some time soon
"Yessir
Whenever you are free sir
After tomorrow morning I’m free for the week","Ok sick
I’m moving into my new place so gonna be busy for a bit
But I’ll be down to play as a break
I’ll let you know once I have an idea of when I’m doing what"
"Awesome bro
Why don’t you have a profile pic?","I don’t know, just never have
Why you ask"
When would you like to smack some balls boss?,"I rate Sunday
Having to go to hout bay over the weekend
You down?"
What time are we playing tomorrow?,Maybe I book the indoor court?
Just let me know what time the booking is,Booked for 18:30. Hope that’s fine. On my way back from Cape Town now.
"Awesome
I can’t pay my half It doesn’t give me the option
Does it give you the option?","I paid for it all, pretty sure I owe you money"
Are you keen to play tennis tomorrow morning?,"Sorry I can’t broski. Going to car service and then having a washing machine delivered tmrw after 11 and not sure of the exact time
I should be able to play on Wednesday next if that works?"
"Hey bro Happy Birthday!
I got my rackets restrung and got us some new balls too so I’m sorted for when we next play",Shit sorry Chris. I responded in my head but forgot to send a message 
"Drill and grinder
Dad got it from buildit
https://www.tiekie.co.za/products/ingco-2-piece-lithium-ion-combo-kit
https://gimmeonline.co.za/product/compact-brushless-cordless-impact-drill-kit-cdli20668/
Somerset Timbers (Pty) Ltd","Oh shot Chris
Thanks for all this
Thank you"
Howit bro,Happy birthday Chris 
I would be keen tomorrow even,"Although only in the evening works
Maybe like 8?"
"Yeah sure bro
8pm is chilled for me","I’ve booked if you didn’t see
On Playtomic"
Howzit bro. Are you keen to play some tennis today maybe?,Sorry couldn’t answer phone… in class 
"2pm?
I don’t mind a time",Sounds good
"2pm sir?
Should we go to van der stel?
Nevermind the wind is going to get bad
So indoor at 2pm?","Yeah sure
Can Kian make it?"
"Nope
I asked him last night",Cool cool
Tennis today sir?,"Sorry in class so couldn’t answer
Not sure if I’m actually gonna be able to today
Gonna be on campus for a while
Sorry"
"Okidoki not to worry bro
Just let me know when you’re keen to play again ",You keen got paddle tmrw
"Yeah sure bro
It would just have to be in the morning though
I have a meeting at 5:30 and a function starting at 6pm","Damn, I can’t do morning
And Friday?"
"Oraait
Friday what time?",Like 7 or something like that. I finish class at 5
I made a poll for tomorrow,"Bro my body is super sore from gym and paddle
Might have to take a rain check on tennis
Sorry"
We play tomorrow?,I’m can’t play today unfortunately   :(
Are you keen to play tennis tonight bro?,"sorry couldnt make it today
didnt see the messages because i was trying to not be on my phone  sorry about that"
Not to worry When do you want to play sir?,"Sorry out at the moment
Will call when back"
4:30 kian and I are playing if you are keen bro?,"just got back
Yeah sounds good "
Oraait,"Where we playing
?"
"Vd stel
I’m here already","Sick
5 mins away"
Is this fine to play outside?,"Wind seems sort of high
Although I don’t know how km/hr is too much
What you rate.
?*"
"It is a bit high for gusts I think
It’s so difficult to say because the weather station is on the mountain
We can give it a shot?
Up to you","I rate it should be fine
I think we should do van der steel"
"Okidoki I’m making the booking quick
https://app.playtomic.io/matches/c01644b1-25ad-4b91-b733-c238b5379f66?utm_source=app_ios&utm_medium=copy_link&utm_campaign=share&product_type=player_booking","On way
Traffic is pretty bad"
"Yeah it is
What does maps say about how long it’s gonna take to get here?","Not using maps but will be there in 5-10 mins
Close to eikerstat"
"Hey bro I have a braai at 6pm tonight with my parents
Maybe from 4-5
At the indoor court?","Sorry Chris I’m in class until 5
So can’t today"
"Hey bro are you free today before 5pm to play by any chance?
I have a church thingy at 7pm that I forgot about last night","Shoot bro sorry I’m out for the next bit and can only play past 6
I’m keen for tomorrow though"
Smack ball today?,Sorry man something came up so can’t make it 
Tennis time today?,"Yeah damn unfortunate
Sorry for late reply… just got back from Volkswagen"
Do you want to play at the indoor maybe today?,"I can’t sorry  got a haircut at 5 and then writing an exam tmrw so grafting today
If you do end up playing make sure the indoor court is still there, they said they were going to change it"
"How was your exam bro?
Are you free at 7pm? We can maybe play miss the smash later then if you’re keen?","See you then. Want me to make the booking?
Or should we try not making the booking?"
Hey bro are you keen to play a bit of tennis today?,"Sorry Chris I just got back home and am shattered
I’m free Saturday though if that works?"
What time?,"Any time
I’m free the whole day
What time works for you?"
Are you keen for some tennis today?,"I somehow messed up my hip from the last time that we played, so I don't think I can make it today sorry chief. just want to let it heal"
"Okidoki not to worry bro
Try and click it",nah I don think its anything serious thankfully. Just any sideways movements sting a little
"Maybe it’s just out of place. I get it a lot
https://youtube.com/shorts/m8R9x2SrxrQ?si=6imcem_X2YDoyOrE
The second part is what I usually do. But push your leg sideways more than what he is Then it will do a little pop
And you’ll be all fixed
But I think it’s just your hip that’s out of place
Needs to be popped back in
If you do it right then your lower back/hip will click","that's me
right now"
How are you feeling today bro?,"Definitely better after the stretches
Faith’s birthday today so cant play this evening but keen for tmrw if you keen?"
So I'll hear from u,I think I’m going to get to the airport at 1 so I should be able to get it from you. Thanks again for all the help
Hey Sir how far are you now?,"Hi ma’am, we are running late so will probably only get there around 13:15. Is there anyone you can give the knife to at checkin?
I’m sorry about this"
"I'll go the and check now ,then I'll get back to u",Thank you ma’am
"U welcome sir
I give the knife to the lady sitting at counter 83(Asanda her name) plz let me know when you get it","Hi Nosi, I got the knife. Thank you so much for the help!"
"Eish, sorry I didn’t see your message
Did you get it in the end?","Nah unfortunately not  no stress brother. Is it chilled if you still send it through, thanks man"
Eish sorry to hear that ,Thanks man 
Work is busy but satisfying. Hope your work is going well too. ,Happy birthday dad!! Hope you have a great day today
"Hi Nic. Spoke to Joe Van Niekerk today being Max's father. He has sent me his work email and asked that you and Faith send him your cvs. He mentioned in passing that he knows the best IT company in RSA but I have forgotten their name but assume that they service Discovery. He is, I assume, suggesting that if you impress, he could make an introduction with this company. I am not sure if this relates to this vac or later or whether it relates also to Faith, but I think it depends on your performance. I think you and Faith must do full vc's with testimonials, matric and other results. Mom and I will obviously help you guys.",Flip that’s awesome thank you dad. Maybe we can call soon to catch up and talk about it??
"Hi Nic. I want to start taking Creatine. Can you suggest a brand and dose etc. And where can I buy it.
Hope your studying is going well.",And then also make sure you drink enough water
Good luck Nic for your exam today. I'm holding thumbs. ,Thanks dad
Hi Nic. Good luck for your exam today boy. Let me know how it goes.,"Thanks dad, I’ll let you know"
I have been watching a series on Netflix called Kleo. It's a little off the wall but fun. Well made and good acting. Give the  1st episode a try,How’s work been?
"Hi Nic. Did you have an A1 today? If so, let me know how it went. Love Dad",Hi dad. I did write today. It was a tough one and could go either way. How’s work been?
How was your exam?,Exam went decently. Will be a pass. Feeling relieved
Hi Nic. How is it going? Haven't heard much from you. 100% studying,"Hi dad. been studying hard, not much going on at the moment. If you guys are still up we can call?"
All the best for today boy. Let us know later,"Thanks dad, will do"
Just saw this on the wires,Looks good
Not sure.,"https://www.instagram.com/reel/DDZAxUnCo_r/?igsh=NGs1aG9icjU3aGMz
Trailer for 28 years later"
Hectic. We must watch that,Agreed. Looks good
"Predictors = model =
Meaning that the different models will show an increased divergence from each other dependent on their features","Sampling features results in even more predictor diversity, trading a bit more bias for a lower variance."
Hi boy. How has your day gone so far?,Good thanks dad. Just got back from tennis. Plan on packing a little bit more and then getting some food
Hi boy. Sorry I was abrupt with you earlier. Just had a busy day.  I was not pissed off with you at all. Chat tomorrow,Can you please send me your bank details so I can pay you for my contribution to moms present
"hi, i actually do yes! ",Ok cool cool. Will definitely get the both the ecos notes from you
no problem.,Ok cool cool
thanks! please send me your email,"nicholas.mosb@gmail.com
got them! Thanks so much!!"
"anytime
i’ve sent the 388 notes through as well
i’m glad good luck!",Hi!! I can’t seem to see the 388 notes… did you send them via email?
"hi! yes i sent them via email, it’s these ones
did you get the mail?","Just double checked an it was in spam, sorry about that. It says the link is expired
Never mind was still able to download them "
"so you keen for golf tomorrow
i’m going to try book for observatory cause they got a special for game and cart for R225","Shit sorry I’m not going to be able to make tmrw
Some stuff came up
Also says it’s going to rain tomorrow"
"I miss you
What you doing",What you doing??
"At spir
Spur
I blame nala","That so sad
I’m feeling lazy
Very lazy"
Be lazy boo,Why?
"It’s holiday
Just take gotcha
Today","Maybe
Are you going to though ?
Going to takealot
Want to send me your stuff so I can get it too?"
I love you,"I love you mooore
It’s huge
What you up to?"
"My mom want to video call you to see nala
Hehe
Yoh busy??
You*","Math stats
Bleh
What you doing??"
"I SAID NO
GO LIE IN BED
BE LAZY
Do you lover
Me
*",How’s essay going?
"I miss you
I love you
She’s looking bigger
Have you eaten","She’s looking longer
You?"
"Meow meow meow mow
I finish essay
Busy doing references","World record
I’m going to go to sleep now
I love you"
"No
You not allowed to
Bitch
Fine
I love youu
Sleep so pleasantly
And I hope baby sleeps well toooo
I loveeee you
Excited to see youuu","Soon soon
Bye boo"
"Bye booooo
I love you too much
I miss you","I miss you too
Byeee"
"I miss you more
Byeeee","Hellooo
How you doing
Does your mom have anchors for the holes?"
My mom can quickly go get,"Top right or middle top usually
But then I’ll have to get a drill bit specifically for that
Maybe when I get there we all go?"
"Sigh okay
Can you not just drill a hole in the wall or how does it work? But we can go when you get here cause my mom needs to go anyway",I’m going to gym and then I can come
Ooookay,"I’m going to stop at that build it along the way
They’ll have"
"Why
But we can go here",If you want to ? I don’t mind
Up to you,"Nope
You need to tell me
Does your mom want to get other stuff too?"
"My mom will pay you back if you do
Whatever is best
I not sure
I love you","I love you too
I’ll see if there’s parking outside but there should be
Then I’ll just go there
Can you send a picture of the railing
For the curtain
How big is the screw that holds it on"
"Why don’t we just go when you get here
We can all go together
Cause then you can look at it
And see what you need",Im at builders
"And my mom can imbuy
Oh
Whoops
I’m
Mum
I ask my mom","We need for shelves
So I might as well buy… worst case she can pay me back"
"M mom says just the standard
We not at home right now
My mom said standard size
Sorry I’m not sure",What’s the address
"70 uppermill street
Which car you bring",Here
"Megan has only replied now but is it okay if I play Roblox with her for a bit and then we clean
Max an hour","Yesss
Of course"
"They needed to 
I was too scared to
So I said I didn’t know your code
Hi
Make sure to let me know before so I can be there on time
I love you","Hello
Can you pick me up from the neelsie"
Want me to come now,We going to walk there
I leave now?,Luke wants coke
"I meet you by chem building?
Road
Cool cool
I think I might bring princess
For a drive
In her crate",Yes yes
"I see you soon
I love you
What time should I leave",Love you
"Maybe get Marlyoms
Are they the same price??",Yeah
Check if ther is a kitten one,No kitten ones
I safe,"Yay
You there already?"
"I drove on a huge road for a bit
Had to enter from the side
Like the n2
She look crazy","And I bet you were perfectly fine
?"
"I was shocked
But I was fine",Haha
It was only for a little bit,"Confidence booster
Good
Good practice
Eat breakfast"
I love you,How you doing?
"Are you class rep for 315
Well did you end up going for it","No why?
Just made the group for it
How’s it going?"
"I sweaty
And sticky
And want to come home
I so tired","What time it end???
I’m going to tennis now
Love you"
"Oooh
Okay
I love you",You still there?
"I love you too
I out way too much water in my smash
Now I have to waste more time boiling it
I don’t think I can revive it","Haha
Don’t you have more mash to add?"
No,"If you keep boiling it it should work
Is it getting better?
Awww
She so weird
I’m getting by a haircut on Tuesday
She’s the cutest"
She was going crazy trying to climb me,"Hehe
She sleepy now?"
"The guy that goes on walks
Smokes
He’s sitting outside having a cigarette",Raiiiin
I love you,"I love you more
Goodluck
Almost done"
"Oh what?!
Gosh",Whole way
Sorry,I know right
"That was not
Enjoyable",Done
