Message,Reply
"
Man!!!! Cute!!!!","How can I send my prescription to stelkore?
Should I call them to ask?"
So I know it's early but for Faith's bday??,Can I call?
"I'm sure she could.
If not, we could do one as a sublet I assume. Check with Jean first though.","Can I call?
If not at dinner"
Kelly is lovely ,"So glad to hear
She similiar to Dan?"
Aaahhhhh!!!!,Let me know how paddle goes
Will do. Only playing at 4,"Okay cool
How’s the new phone?"
Thurs,would of been nice to be there
"Yes, Dan will take her home tmw and go for lunch with her sister","Yes
Thankfully they didn’t charge anything
Got the full refund for the modules"
"I saw that, just wanted to dbl check they got the modules correct
How are you feeling about it now?
Do you have the couch yet?
And how's my baby?",Morning zoomies
So damn cute!,Have Dan and kelly left?
"Yes, they left around 12.30 and went to the Rosebank market. Now at Kelly",You guys free to call?
Do you want to sell your gaming computer to Adam Scott-Hayward?,"He can have it
I don’t think I could sell it… it’s somewhat old
Would feel bad if it stopped working so rather he can just have it"
"Break an egg into a coffee mug, stab the yolk a few times. Add half a cup of water. Cover the mug. Stick in the microwave for 1 minute. Check. Do another 10 seconds if need be. Awesome poached egg","awesome thanks mom
I might actually try it today a well"
"Jayde says you guys are thinking the 26th for Faith's bday?
And the others?","obviously no pressure, I think its going to be paddle and then food
the other weekends faith has exams"
How busy are you in the week leading up to the 26th of April?,"ive got nothing
so i'm free"
thanks I got this letter now too.,You want to call now?
"You free in 5?
Tmw good too","At the 21st
Will be back a little bit later
Will let you know
Does the evening work?"
"Should do, let us know when you're home ","Just got back
Ready whenever"
Dad sleeping...when he's awake??,"I was thinking that for dads birthday maybe we find a place that you send photos too and then they make a photo album from those photos
and we do family photos and even individual photos of us?"
"So Dad and I will come down on the 24th and stay in Stellies until the 28th. Do a birthday breakfast for me, say goodbye to you guys and then head off to Blouberg or somewhere like that.
Are you guys planning on coming back to Stellies on the 26th after Faith's thingy?","yes sounds good, I would really like that. I assume that means Dan is not coming?"
He is trying to decide. He wants to be there to celebrate with Faith but will be there again mid May,?
"Yep
They went back to her place after Warren's party, came home for a short bit on Fri to get hiking stuff, went back to her. Were with us last night, then lunch at her sister...","jeez
glad to hear its still going as well"
I'm assuming it's easier for you not to join us in Blouberg cos of Faith and Nala?,even if its for a short time
Yes,Attacking faith 
"I'll phone in 5
If that's ok",Yes that works 
Final bit of the money from the varsity,Thank you guys !!
You should receive a code from pudo soon,Yea it does
"OK, so maybe we can bubblewrap it and pudo it?",sounds good 
Lego?,Definitely
Sent to Faith...thought of her...,You get a new one already?
Didn't you write today? How was it?,Yes I did. Went decently thanks
Good luck for tomorrow ,"thanks mom, only writing on Tuesday thankfully."
How was it?,"Went better than I thought it would
Thankfully"
You must still tell me what we owe for meds,Spoilt and weird
This is all I can see.,Thankfully they are running the generator most of the time
Power back on???,Unfortunately not no. But they’ve had the generator on all day so we’ve had power. It’s just the worry of it switching off at any time brings uncertainty
Yebo. On your phone,"I don’t seem to have it any more for some reason
I’ve looked through everything"
"OK no stress, I'll do it",Sorry mom. Thanks
Sawubona,Who’s this?
Qiniso,I think you have the wrong number sorry
Isn't Mbali Ngema?,No sorry
We going to boschendal at 1 tomorrow then some drinks after. Dan said you were busy so don’t stress if you can’t make it,You should go to delapa
You keen for pádel tomorrow?,Yep
"Uh sorry we found someone else
I’m keen to go out and play pádel after tho",So not sure if we’ll be able to
You and faith keen for a wine farm tomorrow?,Yeah for sure
Cool. I’ll book now in a bit then,Sick
You wanna come by my place at like 2:15 or you gonna go straight there?,Anyone else need a lift?
I think we’re good,Who else is coming?
"Kiara, some mates from Eng and possibly Chris. But Chris being Chris is not giving me a straight answer",Would be simpler
Just a heads up. I’m pretty sure my Eng mates are autistic so be prepared for that,That’s my favourite type of Tism
All I’m saying is that if you don’t match that energy. Imma be disappointed,We here
I’m keen to do the braai tomorrow,Sorry kev I’m not feeling to good so might not be able to make it
Cool thanks man,"It’s make testparser
Or something along those lines
It says it in the make file"
Oh yeah I'm dumb thanks,Nah no stress lol
Forgot it was the test one,I did that too
"Oh okay yeah 100%
But I've got the general concept? ","Yes yes
You do"
"About time 
You're a life saver","No wait
No
Token.type won’t return type
It would return tok_int or tok_boolean
If if it’s either of those then you call it"
"Then what is type token for?
But I get what you mean
Yeah I think you can either do it ther le or manually",I think I only did for type and expr
"My head hurts, but I think I'm getting there, was just overcomplicating it ","So ( I think
Tok_lpar"
"If I don't call expect_id(), which they say isn't necessary for the parser in the spec, do I need to get_token() every time there's and <id> or not? Because expect_id() had get_token() in it but I'm not calling it.",Yeah you call expect(TOK_ID) instead of it
"Yo, what does your parse expr look like with type checking? I'm 99% sure I'm doing it right but I'm a bit shady on a few things ","Got too busy of a schedule… so decided to leave it out because we don’t need it for the last hand in
How’s it going?"
"Painfully 
You made the right decision","That part wasn’t too bad
How’d you find it?"
"By fat the easiest one for me so far
Because the documentation amd skeleton code is actually good ","Could you send the style checker your used for the last hand in?
I tried to download the one from SUNLearn but it doesn’t seem to be working"
"I'm using the one from sunlearn
Ill send it to you",Thank you 
"But it reports a bunch or false stuff  I mostly just use it to check for whitespaces
I can email it to you?",Yeah of course
Aight I'll do it now,"Thank Sebastien 
No rush though"
"Okay it sent, lemme know if it works","Just got it 
Thanks bro"
Please call me if they start a tut test ,Ok cool I will
You coming to comp Sci ?,"Nah not today weather was putting me off
You there?"
"Yeah I have, I'm super comfortable with the hamming codes and IEEE 764 and boolean algebra stuff, its just the theory I'm worried about I don't really know what to do there
Cause if he asks super detailed stuff I'm probably not gonna remember everything",You back home?
"Yeah, I'm leaving for gym now",On my way too
"Aight I'm here, I'm by the pull-up bars, just lemme know when you here","Just got here
On my way in"
Cool cool,How was comp sci?
"Dude my codegen got fucked
I don't know how
It all worked when I tested it
Did fine in type checking
I'll still probably pass but we gonna have to work for it
Just need a 75 average for the a1 and a2 and do okay in the assembly tuts and I'll be fine, but gonna be close
I'm just done with this class",I wonder why? What were the errors?
"Dunno, the only comments is style check stuff",Same
"But I got 0 for style
Somehow
Even tho I had no errors on the style checker
Worst case I need to redo next year, it won't add anymore time to my studying but it'll just be a pain","Honestly wouldn’t be surprised
Especially if your stuff worked
There’s very little reason why codegen would work for you but not on tests"
"And Willem was pissed this morning, I think he's been getting kak ton of emails
Idk
How'd yours go?",Nothing amazing better what I expected
"Sat down and redid practical 1, just in case you wanted to take a look at it
Actually so mad that I couldn't figure it out during the prac, but now we know","Oh sick thanks man
You going to the tut
?"
Working for me,"Oh Damn
That’s way simpler than I expected it would be"
"Yeah no same, I was expecting to sit there for 2 hours",How the tuts going?
"Not too bad, did a fair bit of playing around with assembly over the weekend so getting the hang of it. Just looked at tut 6 and 7, 7 will be easy but 6 is gonna take some thinking, won't be too bad tho I don't think
Btw I'm gonna go grab some ice cream at 5:30 for my birthday if you'd like to join :) and you can tell mia and Adrian and everyone else that they're more than welcome to join
Ice cream will be on me btw","I obviously don’t know if it’s gonna work
So maybe I’m speaking to early
Is your birthday today?"
"Ah no stress, we're going to a place called Kristen's btw","We on our way
See you now"
"No worries dude, we gotta grind through this together ","I got half the test cases for binary search
I quickly did it
You want me to send ? Or you done with it?"
"I've got mine working, thanks tho
Yours work 100% now?
I spent an hour trying to debug just to find out my dumbass put a dec instruction instead of inc ",I hate assembly honestly
"Yeahh I get you, we'll get through it tho
I'm gonna head there at 12 already, gonna try get as much done by 5 as possible","Okay awe I’ll actually join you
Just eating quick then I’m gonna go
I’ll see you there"
"Sounds good, see you there","I got tut 6 to work
Mostly
Spend so long fixing seg fault and it was literally just because I was using ebx without preserving it "
How's the a1 mark looking?,"You?
You get your 100?"
You go to gym yet today?,Well done
"I'm just craving social time ngl  ever since I actually started talking to people I feel so shit when I'm not doing it. Anyways if you guys ever go out or do anything and you got an extra spot lemme know, would be sick",How you feeling for your exams?
You?,I start tmrw and then write again on Wednesday but after that I have like 20 something days until the next one
"Ah it's all good dude no stress, had a good time. Yeah for sure that sounds sick, how about tomorrow? I'm happy to train anything",I’m also happy to do anything
"Absolute life saver thank you :)
Imma be at the library tommorow and Tuesday if you wanna join",What time you going to the venue?
"Yoo, how'd the move go?
Just wanted to ask if you know what's going on with comp Sci marks
Cause even tho I'm 99.99% sure I don't have an A3 it would be nice to be 100% sure
My results tab doesn't show the A2 marks
Idk I might be dumb
Absolute genius
I'm so dumb
I'll check just now","I did that too
The only reason I knew to check sun student is because of the WhatsApp group"
"But we chilling
How I passed this module with my project going the way it did I'll never know but fuck it I ain't asking questions",You deserved it though. Biggest academic comeback
"Yo dude, how you feeling for next week?","I don’t feel like going through what I did last semester lol
How about you?
Who’s the girl in your profile photo ??"
"But we have to go gym sometime, you back in stellies yet?","I got back a week and a bit ago
How’s your timetable this semester?"
"Hi there! Yes I do, the micro is a combination of the textbook and slides, and its R60 :)","Cool, I’d like to buy! Thanks"
"Great! I will send you my banking details :)
Account Holder: Miss Kayla Stoffberg
You can send me the proof of payment whenever you are ready :)
Just that you are aware, we did not do chapter 9 for micros last year
Perfect thank you! I'll  send it to you now Just a request I ask everyone, is to please not send the notes to anyone who hasn't bought it directly from me :))
These are notes and memos i took in class, as replacement for the micro section chapter 9 we did not do last year
If any problems arise, please feel free to let me know!",Thank you so much !!
"That is the monetary ecos section
With a few framework questions and solutions
Additional notes I found helpful, to explain core concepts:
Tutorials for the trade section:
And the solutions to the A2 from last year:
These should be all the documents, if any problems arise, please feel free to let me know!! :)
And please do not send these documents to individuals who have not bought them directly from me",Thank you!!!!
"Nick
How is your mathstats mark looking","Actually better than expected
You ????"
"Nah i failed
Gonna have to write A3","Shit
How much are you gonna need to pass the module? A lot higher than 50 or pretty much 50?"
You are so blind ,"Hahaha sorry
My phones WhatsApp cooked so calls don’t come through
And yea I’m blind
Did I walk past you again?"
Yes but if you are persuasive enough i will join yours instead,"Hey Handsome,"
"""Aw, shaddup and listen, pal! I 'preciate the invite to join yer little university project group, but I'm afraid I'm gonna hafta pass. I got other commitments, see? Like takin' care of my own skin, if you catch my drift. Can't be worried 'bout no group project when I got my own tail to cover. I mean, I'm a busy guy, always on the move, gotta keep my eyes on the prize. And the prize ain't no group project, if you know what I mean.",If you don’t join my group I’ll do something naughty
"Look familiar?
Bet it does",:/
Do we have the data science prac today?,"No idea
Are you going to go?"
"Ye
Im just gonna see if we actually have one lol","I’m gonna go to
Does it not say on the module framework?"
Im in class can you check?,I’ve checked but can’t see anything
I take it you’re not going anymore?,Not a chance
"Are you going to datsci today
In the neelsie","Nah I’m not, I’ll start going next week. It’s been a waste of time so far"
"Ye im gonna
Tell me what group number we gonna choose","Okay
Hold on let me log on
We gonna kill this project luke
I swear
I rate group 3?"
I take you’re not coming to class,"Nah lol
At gym now and then gonna do some kaggle at home
Gonna go tmrw though"
Enjoy,"You coming to data science
?"
"Of course
Hold a spot next to you for me babygirl",I’m not going to data science today
"Okay
Thanks for letting me know",When you froze the notebook in data science how do you fix it? Just waiting it out?
"Idk what i did 
I just like closed and reopened the  tried again","https://youtu.be/6GUZXDef2U0?si=rgG9L_cXzdJaZC_4
This videos pretty cool"
"Oo nice
Thanks
Have you thought about the hackathon yet","Yeah I have
Bro I would love to but don’t think I have time to do it
Sorry about that"
Yes and yes,"Surly meet me at the neelsie
By the stairs
I’m almost there"
"Ok
I have math now so give me a sec to walk from class","Ok awesome
Meant to be awe
Awesome works
I’ll sit by the stairs"
Okay,"I’ve gone up
Sitting at the top, more seats"
"Bruh
Oh ","Nah I’m still waiting, just at the top"
Im almost there,Awe
Sorry there was a tracfic jam,Nah no stress
Yo im gonna be at the gym a little later… i just wanna eat something,"this might be dumb question
but how do you test your code
for scanner
im baffeled"
"I appreciate that you assume i know the answer to that question
But I unfortunately dont have the answer
I havent started yet","i recommend starting soon... first hand is in 10 days
and theres a lot to understand"
Yeah ive done my planning and read through the first chapter,like ive been working pretty hard on it today and ive only written like 2 lines of code
"Just need to start cosing
Coding","ohhhhh
fair enough"
"Nicholas
Can i give you a call for like 5 mins",Yea
Idk who tf that is,"Me neither
Seems like a smart name low-key
How’d the project go?"
"Hello
For the ReservedWord array right
Do we HAVE to populate it manually? Or can we make a loop function to populate it…","Just ask chat get to do it
But manually
That’s what I did"
U coming to the prac bbg,"Nah lukie pookie
Gonna work from home
Start studying the data science theory
You gonna go???
Are you just working through prac 2?"
No theres a lecture,"Do you have the textbook for data science
So I don’t have to go download it"
"No
She said it’s free
So
Theres a really pretty girl here damn","Do you rate it’s worth it to go through the book?
Or just slides
What she look like"
"And shes wearing a trench coat
With cargos","Doesn’t ring a bell
Have you seen her in other classes?
Grind starts today"
Oh nah she’s definitely not in our classes haha,"Bro
I cannot find the textbook
Like what it’s called
Anywhere"
ISLP,"Oh, that makes sense"
"Hahaha
We getting our projects now","Is she going to explain it in class
?
Now?"
Thinknso,"Fuck
Oops"
"It’s ok
I dont think you’re gonna miss anything
It’s on sunlearn now",How does the project look?
Hard,"Do you know what time the gym opens tmrw?
Cos it’s a public holiday"
No idea,"You look cute bbg
What you hitting?"
"Legs
Im loaded with caffeine tho cuz i wanna grind compsci tonight
So",How’d it go?
"It’s going fine i think??
I finished most of the things that we need done for friday.
I hope
And you","Was going great
Until now
Got an issue that I can’t fix
Have you got comments working
Nevermind
I fixed that shit"
"Hahaha was it the assertion error?
I got that too
Took me forever to fix","Different
I had finished comment a while ago but then tested it again yesterday just to make sure… and it was all fucked
But was an easy fix actually
Also, is she discussing project in class for data science"
"Idk bro
We need to get together to start on the project at some point
Please","Yes I agree
When you thinking?"
Uhhhh what abt tomorrow afternoon?,I finish math stats at 5
"I think our group member is that one white guy that always sits alone
I think… idk tho",The guy I said I was going to ask?
"Yuh
But we need to find out who he is fr tho
Im just theorising","I’m not going to class
So I can do anytime"
"Uh ok im at gym
This rain is kinda off-putting tho","Fr
You still want to do it?
I don’t mind"
Nicholas please just lmk what you think ,"Oh shit my bad pookie
Yeah I agree
I really don’t mind
Any day works for me"
What?,"You used his full name
Was so formal"
Just jn case theres another Jean-Luc,Did he message?
Nope,Imagine he just mizes
"Bro this guy
Maybe hes one of the ppl who didnt make it but he hasnt been removed from sunlearn yet","Could be
Maybe he’s just shy
Will message later today
Not really sure"
Yeaterday ye,"Oh ok fair
I’m probably gonna go the evening"
Why?,So if you want to come too
"Ah okay nice
I have OR tut til 5","You down to go today?
Cause I’m happy to go after that
I just want to make sure it runs on narga
And then submit plagiarism"
"Are you gonna add your chat gpt logs 
Can you forward me the test cases from the group pls
Cuz apparently it’s not on sunlearn","Are you going to go into narga to submit?
Tomorrow"
"Uhhh yete
Yeah
Im just gonna make sure everything is submitted correctly
Probably not gonna stay the whole tut unless theres a chance of a test",So have you submitted already?
Gonna do it later tonight why?,"Just curious with what other people are doing
I’m gonna do the same"
"Yes it is the best strategy i think
I mean if you passed all the test cases there really isn’t anything more you can do","True
I want to fix comments though
How did you do yours?"
Whats wrong with your comments,"Don’t know
I didn’t do the doxygen commenting style"
"Ohhhhhhhh
I thought you mwant the function
Fuck i forgot about that
Doxygen is a documentation software
Like it’s a separate program you use to document stuff
Isk if it’s supposed to be handed in for this submission tho
Like where do we even put that shit","Nah lol there’s nothing else I don’t think
Just the way you do your comments
Like this
Instead of normal"
Oh are you sure?,"No
But I think so"
"Pkay i must have misread
I cant check rn ",Why?
"Im at gym
But ill lyk when im home",Should we meet up on Sunday?
"Definitely sunday 
I have a headache",Naughty naughty
"Ok we can do 17:00 because i have to work on my project
Ill message the other guy to ask if he’s here
Can we meet around your place?
Actually you can come to mine. The Jean Luc guy isnt here but he said we should just keep him updated",Sounds good
"Mom’s bday
But he stays in wilgenhof",How long do you think it’ll take to do the parser
"Oh yeah btw when you get here, please just park on the side of the road and not the driveway",Could I come at 16:45?
Ye you can come whenever,"Awe I’m leaving me now
Awe I’m here
Pookie"
Lady added new data camp courses,Are they useful for the project??
Why did you clog up the narga nicholas,Wasn’t me I swear
Make sure the <> inclusions are above the “” inclusions,"But there’s errors in codegen.c file
The idpropt
Yeah
Oh
We not supposed to?"
"Do this
Trust",I swear
I thought codegen.c had a spelling mistake but it doesnt,"Maybe I haven’t included everything I need to
Let me go try"
"The order of the inclusions are very important so maybe just switch them around a little 
My program works fine
So idk
Maybe dont import codegen
Lmk if you fixed it","Yeah I can’t seem to get it
I’ve imported everything
You legend
Ignore that
I’m such an idiot luke
My stuff was right
I was doing make simplc
Thank you for the help bb"
Howd the project go,"The mark for scanner?
Went really well for me, you?"
Same,But this hand in is a lot more than I expected
Oh fr,"For name…. Is the tok_get only expected if there’s an index?
And if it’s an arglist you don’t need it
Ohhhhhhhhhh
Ok thank you"
No bbg,You at gym pookie?
Am getting ready,Can I call?
"Give me one sec
Sorry
Ill call back now
Wifi acting up
Damn it all
Idk it doesnt make sense to me to give an error of paranthesis expected
Email the lecturer he’s usually very fast with replies
I canr because ive emailed him wayyyy too much by now ",I’m gonna ask on teams
"Good idea
Sorry that i couldn’t help
And that wifi sucks","I’ve found the answer
They were right
Because type is in a square bracket, you have to check if it’s type before you call type"
Can you lmk if you find out which other functions expect the same??,"I don’t think parse_type() does for anything else
I’m doing math stats no but will let you know"
"Im struggling to read these rules imma be real
Im so behind with data science im gonna do that shit now","Why’d you delete a message luke?
Sorry had gone to bed lol"
"All hood
Good
What are you training at gym today","Chest and back
Actually no
Legs maybe
What you doing?"
Back shoulders arms,Did you get the tut test?
"No
Partially",How was parser marks??
Good and yours,Not as good as scanner but pretty good. Lost some marks in style which is annoying
"Yeah same
I failed a small amount of test cases too
Yeahhh 
Idk it’s weird
Wish style wasnt so heavily penalised tho
I lost 5 marks for having a bracket on a new line
Like how is that fair
Also the dont copy and paste ",I don’t think Willem and the guy who made the test script have that much communication
Were you accepted for the shoprite bursary,"No lol
You?"
"I was
Kidding
No","Hehe
We just not good enough"
Idk how good we need to be ,Where you luke
Here,When you going to gym today pookie
"Right now
Im like
So fucking annoyed",Why luje???
"Idk people are stupid
When u going","What did people do
Have you started on comp sci project"
"Ill be there in a few minutes
Train slowly for me",Where you lukie
"Im at home now
Putting on gym clothes
Then coming","Nooooo
Okay I’m gonna miss you
Dylan is here though"
"Okay
Sorry",Nah no stress
"No boss
And you
Im gonna use the tht tomorrow to start tho","When you do I’ll show you a yt video
Will save you time on the hash table
It’s been a life saver"
"It’s such a nice day out
Now we need to sit in a hot room for 3 hours
With a bunch of sweaty anime watchers",That’s my ideal Friday luke
"Yeah sure
Will you reserve a space for me next to you
What time you going","Probably will aim to get there at like 2
To get seats and stuff"
Narga G right,"How far are you?
With comp sci"
"Ah sorry man havent worked on it again
Forgot to push work on narga","Didn’t have a question
You going to gym today?"
"Im considering
Havent done too much chest throughout the week
You?","Ye I’m here
Almost done though"
Bro data science is soooo much work,"Was literally about to message
There’s so much practical work to learn as well
We cooked"
"Yeah it’s crazy how much was covered in a few weeks
But i dont think we need to explicitly memorise the mathematical formulas… idk it doesnt seem like something we’d be assessed on since we’re not doing math  yk
The proofs yes but for example that Prediction Interval for simple linear regression
It’s a massive formula that we basically never used",But other than that I don’t think there’s any point
Like this for example ,"I’m only gonna learn the important ones
Thing that seem relatively important to the topic
And I feel like the formula for calculating the coefficient estimates is pretty important"
"We’re writing a spot test in compsci and ur missing
Im kidding dont actually run","That’s not nice of you luke
Lucky I didn’t see the message until you sent both
Would have had a heart attack"
"I was scared you might be running to class lol
You gymming today??","Here now
Quick session
You?"
Coming in 30mins,I just left
It was a while ago when me and my friends tried to get the most fucked up ones so i cant remember,How hard do you think the practical side is going to be?
