Message,Reply
"Hey Nic. Congratulations about  your achievement. Sounds fantastic. Let us know what that all means practically. Let's chat on the weekend and we can catch up and discuss this. As previously discussed, any discount obtained by you for tuition will be given to you. Love dad","Thank you dad!! I think it works out to around R12000 off of uni fees for the next payment to the uni, but not entirely sure. Hope works been going well"
A quietish day but because I rode with Kevin this morning my energy started waying after 2pm. Eventually went home. The first few times are going to be rough. What did you write and when will you get youtlr marks,Is work still busy recently ? Or relatively quiet? 
Hi Nic. How are your feeling?,Took the last two days chilled so definitely feeling more relaxed. How’re you doing?
Hi Nic. Did I pay you last month?,Yes you did. Why?
Good luck for today. Wishing you a fair paper. Let us know,Thanks dad
Photo,Is it a new movie?
10cm maybe.,Measures it and yes it is 10cm
The question is how much you need get the machine closer to the wall to get the door closed. May only 2cm? My concern Nic is that you would need to raise the machine quite a lot to get it over the tap. This must be resolved by a plumber i think. Maybe add an extension against the wall (elbow joint) to lift the tap above the machine?,Would have to lift it probably 30cm up. But that work because we want a cupboard/storage thing underneath to keep our bathroom stuff
Hi boy. Sorry I was abrupt with you earlier. Just had a busy day.  I was not pissed off with you at all. Chat tomorrow,"No stress dad, knew you weren’t mad at me. Thanks for helping me sort this out"
Hi Nic. How's it going? I understand that you are working towards a test?,Hi dad. All good here. I’m writing a test the evening and have another one next week Tuesday so ramping up the work a little bit. How’s your work been?
Hectic. But relaxing a bit. My stress levels have been too high but now doing 10-15 min an tge indoor bike and sleeping earlier every night. Seems to be working a bit. How is Faith? How is Nala?,That’s good that you’re taking care of yourself. How’s the new employee? Faith is under a lot of pressure at the moment so she’s quite stressed. Nala is growing super fast and is full of energy but she still very sweet
"Hi Nic. Daniella started on Monday. I have very little contact with her but my feedback from Jessica is good and she is pleasant. Vee had her operation yesterday and she may be out for as long as 5 weeks  one step forward and 1 back. Iro Faith, at least you are there to make things easier for her. Please send her my best. Can't wait to meet Nala.",Yes really looking forward to having you guys here. Is she not going to work at all in that time?
i’ve sent the 388 notes through as well,Awesome thank you. Notes look great!
Why the hell was I so keen last year to be in uni,Fr
Rico had the right idea fr,Fr fr
"Not much honestly hey, uni has been keeping me pretty busy",That’s good though. Still enjoying your course?
And yourself ? How's things with faith ?,Yeah bro also just so busy with work that not much else is going on. Everything’s going well with faith too
"Yeah still enjoying it, probably going to see if I can finish this course and then do honors in physio",That sounds good bro
Listen boet you need to come back in June so we can get up to some tomfoolery,Fo sho
"Definitely, are you free today ?",Yebo
0:51,Not too sure how well tmrw will work. I have to be here for the people coming to fix my moms car and and have an eye appointment at 2pm
What time do you want to gym ?,I’m not sure when I’m going to be done at the optometrist
Are you and Faith gonna be busy at 9 on Saturday,Morning??
My bad forgot there were two 9 o'clocks,lol
"Got varsity for a bit, and then I've just got some work to do",Sounds lovely 
"Happy birthday broski, have a great day and a blessed year ",Thanks brother 
0:54,Of course. You really are my boy no matter what. Hope you have a good year too bb
Please confirm your ID number,0402055190084
But I wanted to know if you’re down for padel soon,When you thinking ?
I was checking for this evening since we have tomorrow off,Im down to play tonight
We need to pick another day it’s raining tomorrow,Ok yeah fair enough
Firstly thank you so so much for inviting me tonight I had the nicest time my brother,I’m so glad brother
Idk if you remember but I was being dead serious about building my desk so lmk when you’re free,"I’m keen, could even come this evening if that works?"
That would be beautiful,Does 16:00 work?
17 Dennesig street,Sick thanks
Once again bro thank you so so much for helping it means a lot,Of course brother
I will most definitely be seeing you this weekend,For sure
I’m gonna be in Cape Town with some family,Enjoy brother
I might build it tn anyways just bc the box is taking up a whole bunch of space,Cool cool let me know
Pls tell faith I said happy birthday,She said thank you
I heard that shi was easy,Ye it was easy but only if you knew what was going on if that makes sense
Anyway what did you get for A1,67 for sec a and 87 for b
Ok that makes me feel better cause idk what you for for the A1,That A1
Good,Thanks baby. What you get??
I just gotta bang that A2 I fucking hate the maths group,Same fr
I’m assuming that you got the epsilon delta thingy right,Yeah I did and you??
100 . 84,Holy shit that’s insane
If the epsilon delta is right then my avg is 90,King
Dylan is driving and I asked him to put you n faith in his car,King thank you
Np man sorry I lowkey got irritated w Josh and Ethan and could tell they were gonna dump the night so I went to drop off Jaseer,Ye bro I think everybody was pissed with them
But I should start Ecos sometime this week because there’s a lot,Valid
How’d you do in the A1?,72
How’d you do in the essay,Got 82
"Also I need a favor, for the last week I’ve been struggling to sleep like this morning I only slept at 6am, not cause of studying just cause. Can I come by later and sample one of those melatonin pills?",I don’t have any left sorry  haven’t been taking anything recently
Depending how I feel I’ll decide if I wanna write it,You have to
If you get these can you send them to me pls.,Will do
But I like like well fleshed out notes a girl made on her ipad,Agreed
I finished chapter 4 in 2 hrs and half of chapter 5 in 1. My plan is. Finish Chapter 5 & 9 today and just do macro exam questions because Ecos exams are so diff from theory,Valid
Was there a Nash equilibrium?,Yeah I got one
Yo,Helloooo
"I’m in DatSci next semester, idk how don’t even ask. But do you think I should like take it or tell them I’m not supposed to and wait for next year?",Ah bro I think you should take it
Also I’m waiting for them to Autoremove me,Did they say they’re going to?
"Yo, Josh told me today you guys are moving into a digs next year . First of all that’s cool AF",Haha thanks Savar
Do yk how much your boy Kiran is gonna be charging rent for in Beau Vie?,I think around 20 a month
"But CS I’m giving it a better shot now, not tryna be lazy again. Project seems cool imma jump on that soon",How the bees going?
Cause I’m actually doing it more than 30 mins before submission,Proud of you
"Well you could ask faith. Tbh it’s more than the chess first hand in, that was like 100 lines or something, a bit more validation here. But I find it not too bad , maybe cause it’s my second time","Makes sense. Well good luck for it, let me know how it goes"
Where are you moving next year ?,Don’t have a place yet unfortunately
Maybe out of stellies cause it’s cheaper,Yeah I think it’s the play
I heard out of stellies . I’m tryna look for a 1 bedroom somewhere too,There’s a lot of nice places a bit further out of stellies
Yeah I’m tryna convince Josh and maps to move or of stellies w me,Ohhh makes sense. You should ask Dylan if you want. He’s looking for a new place too
Like the rents too high,Real
"We can submit an essay multiple times right, just to check out the plagiarism score?",Faith says yes
"It’s weird because it’s not like the other Ecos modules. This is just straight theory, no graphs nothing",Agreed
Damn did you just read the stuff,Yessir
Besides CS I have no other excuse to not do well at this im just not taken to these topics,Yeah they kind of boring
"Yo man, do you by chance have the chess game project from last year",Don’t you have your one?
But it’s okay Josh sent me his,Ok nice
Photo,You gonna go?
Wasn’t expecting anything great tbh,Yeah me neither
65 essay 64 A1,Nice
You,69 for a1 and 75 for essay
How was it ?,I didn’t write
I didn’t like it tbh,Hard or just eh?
I really wish i did that  but I alr booked my flight and mentally prepped myself to go home asap,Valid
Barely anything to do w like the good stuff like money supply and exchange rates,Damn crazy
Does it ever get easier,No
Did you pass,Yeah
Yeah,Daaamn
Wanted to be in a class w you,lol
Gooning and sorts,As you should mr
What’s your holiday plans,havnt done anyhting other than getting wisdom teeth taken out
Bro don’t reply to my November chats it feels like I’m talking to the past,haha my bad
When you in stellies,tmrw
Can’t wait to see you on your birthday though,yeah its gonna be sick. We need to see eachother more this year
Yeah but promise I feel like I only feel complete when the gents are seeing each other,yeah agreed
Can Arya and I come visit and have cocktails and talk about when we were young,thats exactly the plan bb
eThat’s insan,i know right
How’d your rents allow that,they actually wanted it to happen
If I get a 12 month contract at Maties and let’s say I’m not here for June/July and I freeze my account will it count those months in the 12 months or will it negate it,You negate those months
Yes,We can go together
I want to get big and strong like you,Making me blush
I also want to come visit you and see your new place and chill. Lmk when I can,Yeah for sure. In Cape Town for a bit but when I’m back and we somewhat unpacked I’ll let you know
What lecture,Math stats
Are you dual booting windows and Linux,Dual booting
What a nerd,Fr
Ok I think imma do VM,Fair enough
Whenever it works for you,Ermmm let me check with faith
How much will it be split,Will be 150 each including racket
Lowkey broke now at end of the month,Worst case we delay until next month
If you call now it’ll be done by tomorrow morning and we can book it,Yeah I’m keen
Hmm icl a little earlier so choose a date where you’re mostly free,Maybe weekend then? We tuts pretty much everyday unfortunately
I’ll talk to Ari idk how packed she is with exams. But if it’s just gents then I can do it. But I see how you gents move inviting Lockhat over your Day 1,It wasn’t me
"Accept my invite & Get 3 freebies!
https://temu.com/u/EbFUlMjdUqr6YSvX",Temu pyramid scheme
This is the cutest thing ever,She really is
To nga,Nga?
And how’d they allow it,i had to drop not deregister
Are you allowed to take any honors modules without first completing all 3rd year modules,yeah the requirements for the economics modules are only the modules im doing this year
So what are you taking this year,"ecos, 388, 318; cs 343; math stats 312"
And it’s faiths birthday tomorrow,And yours silly
I didn’t listen to you,Noooo
Did you use the textbook,Nah
Any YouTube channels?,No specific ones. Unfortunately at this level of stats there is none really
How’d you learn,Tuts
"Happy Happy Birthday Nic! I hope you have had a blessed day filled with tons of love and blessings. May the year ahead only be filled with the best moments of love and laughter! May you continue to mature into the wonderful young man you are and reap every ounce of goodness you sow. Thank you for being such a loving soul, we cannot wait to celebrate you! ",Thanks so much Reese. Really looking forward to seeing you guys next weekend
Hello Birthday Boy! We just wanted to say thank you so much for inviting us last night. We love being able to celebrate such an incredible young man! We really hope you are alive today. ,Thanks so much for coming :)
Hello Birthday Boy! We just wanted to say thank you so much for inviting us last night. We love being able to celebrate such an incredible young man! We really hope you are alive today. ,I’m alive but struggling 
"Also thank you so much for the jacket, I’ll grab from you guys when we braai. ","Of course, I can even drop it off  sooner… just let me know when you want it"
And I ain’t doing operations or compsci rn,Beyond Valid
I’ve just reached the point where I’ve done everything I can so I’m just waiting for the test now,Fr
We only have to do the questions from 3.1 from it right,Yeah
What time u going to the tut,I leaving here at  3:15
Do u know if we will be able to see and check our test scripts,I hope so
I’m gonna go tomorrow before the maths tut to check the maths stats A1,Awe that sounds good
Wanna hit sharms tomorrow at 11?,Rest day tomorrow sorry baby
Wanna go at 2 to check the papers,I rate at 2:30 ?
I’ll meet u by the pull up bar,I’m gonna do a set of calve raises
Imma do back at 11 then,The cleaners came early so I’m here now
Do u know if they’ve said if we can go collect our LA A1 for math yet,Absolutely no idea
Which ppl did u buy ur notes from,I bought from that one guy that goes to gym
Bro the content of AC term 2 all of a sudden got insane,Serious ?? You rate you passed?
What time u going to vote tomorrow bc I’m also at laerskool Stellenbosch then at least we can keep each other company in the line,Im not sure of the exact time. Sometime around 12. I’m going with Dan and faith and you very welcome to join
Just tell me when you’re about to leave and I’ll walk over to ur place,Probably gonna leave in like 5-10 mins
It was chilled I only studied this morning for it and copied the person in front of me for the questions I didn’t know,Beyond valid
Quarter past?,Awe
Chatgbt just gave me this answer ,What even is that 
I don’t mind playing tomorrow either,Ok awesome might do that
"Have you looked at the tut yet, is there anything we should do beforehand for it",I had a check and I don’t think there is anything
When are u gyming back day? Bc I left my straps in jozi,I’ll need my straps for legs tmrw but you can take mine today?
Awe I’ll do back on Friday then with u if that’s chilled,Yeah of course
Ross says he also wants to gym at like 10 or 11,Yeah sounds good
So which time then 10 or 11,10
Wanna walk at 8:50?,Yeah I’ll walk with you
Nvm I just saw on the group I don’t have to,Yeah we do t have to
What time u gonna go to narga today,Probably 1
Bc I only lost marks on the style check and idk where I lost them,You got all the test cases?
Did they say they not finished with the style checking?,They still going to go through to see if they need to remove marks
Yeah,Damn well done
Oh I’ll double check then,Nah I’m sure you right
"So for exit you’ll just go 
expect(TOK_EXIT);
Parse_expr();
And that’s it",You need to check if it is an expression
Do these seem valid then,Think so
So it’s probably if(token.type == TOK_EXPR) then Call expression,Yessir
Awe I promise I’m not gonna spam the whole day ,No stress bb
I saw you walking by the robot but I was on the other side of the road,Oh shit
Do we need to do these for this hand in,Nah
Do you have a buff I could use,I’ll check
Yeah,I’m honestly not sure if I’m going
I think I’m going to give today a miss,Yeah same 
What’s that game kian showed us in the tutorial,I forgot the name
Road to under 10mins starts now,Goated
Which narga are u writing in?,G
"What time u gonna go to the narga, I want to go early to practice a bit",Probably gonna go at like 12 or something
U only write at 5:40 right,Yeah why?
Just thinking what time you would finish then but it’s probably gonna be too late,Yeah gonna finish at 8
Wanna hit chest tomorrow?,Hit it yesterday
If u go before that pls save me a seat,Nah
Does he know anyone that could plug us last years A1,Nah don’t think so
Isnt it always 17:40,I think class reps said 5:30
Awe then we’ll walk just after 5,Awe
Should we rather just book padel for tomorrow morning,What time you rate?
What time u wanna gym bc Ross says he can only do 8 tonight,Yeah I’m down for 8
Narga D,I’m in D
Sho bby hope studying is going well,Been taking the past 2 days off but good otherwise
"Quick question, do u still have a x by some of ur plagiarism checks on SUNLearn for the project hand ins?",Nah I don’t why?
How was ecos?,Didn’t right. Writing the a3 for it instead
Sho baby how you,Good good thanks
Quick question can I borrow ur fold up mattress this weekend?,Yeah of course
"Shot, can I come get it tomorrow?",Yeah sure
I’m in my stats tut like a studious ahh fool,But you on phone
They are keen to hear from you,"That’s awesome, thanks so much Miguel "
We can catch up tomorrow and discuss,"Very keen, sounds good"
0:38,Thanks so much Miguel  looking forward to celebrating with you guys next weekend
0:12,Ok awesome perfect!
Application emailed,Just got it 
0:18,No worries! See you later
0:12,Done 
Sorry for the late message. Just thinking have they fixed the washing machine tap?,Hi jean. They have not contacted me to fix the washing machine tap nor the broken outlet. 
"I will immediately follow-up again, I'm glad you found a solution but this is something that needs to be sorted.  I'll email them again",Thank you Jean
" Let me follow up immediately.
Sooo sorry",No worries. Thanks Jean
0:47,"Yes very weird that they won’t take the amendment, thank you for helping. "
I emailed you the lease with Faith added,Thank you Jean
Hi Nicholas hope you are well.  Can you please confirm if your maintenance has been attended to?,Hi Jean. Yes the came and it is fixed. Thank you !
Video,Thank you
Yeap I did it was amazing,Oh lekker that’s good to hear
Why do you ask?,Was just wondering about the dress code… did you wear a suit??
When are you going to Moore?,"I’m here this week, doing the same thing you did"
When you flying back?,Just got back
I got back last night. Man it’s cold here,Yeah bro this morning was horrible
"Shared booking at De Volkskombuis

Tap here to accept and add this booking to your Dineplan app: https://dpapp.co/X76n

Table for 6 at 19:00
Wednesday, 21 August

Download the Dineplan App: https://www.dineplan.com
Instant bookings at over 2,000 restaurants in South Africa

Map: https://dnpl.co/K9uqP
Address: 1876 Aan-de-Wagenweg, Krigeville, Stellenbosch, 7600, South Africa",Ohhh okay sick 
Shot for coming,Of course
I want to come and jam with you more. I wasn’t feeling the best today so yea hade for that. And it annoys me because then Dylan thinks he is amazing. Like I am not a tennis player for how many years as well. But yea I want to get better because i know i can,Dude we must definitely play more . Yeah I don’t know why dylan was taking it so seriously 
No cap I have missed you my boy,"Agree bro, missed you too. We must do another braai some time soon"
Yea all good. I will come pick you and your bro an then fetch Kian,Ok sick see you now
Can I add Roxy or nah?,She’s added
How’s the holiday been?,Been good thanks. Nice just chilling
Yea nice did you go anywhere?,Nah stayed here in joburg
I wrote today and I got another exam on Wednesday next week and then the following week,Damn
Not bad so fingers crossed ,Ok sick well done
When you get to Stellies?,Not exactly sure
Okay okay sounds good then we can go for a drink,Great idea
We gonna have some nice braai venues this year,Definitely
On the 28th,How’s it gone???
Because I am going to cpt to see my sisters place and then staying the night,Oh sick. How’s her place?
And then Thursday we can do a dinner,Definitely we must
Happy 21st ! Hope you’ve had an awesome day and got totally spoiled. Can’t believe you’re 21 already it’s crazy! Feels like just yesterday we met back in grade 4 during my first days at Bennies. Can’t wait to make more memories and celebrate with you. Love you my boy ,"Sorry I missed your call broski, busy at the moment. Thanks for the wishes brother, looking forward to spending more time with you this year "
Will casa not have speakers playing music?,No they told us that we have to bring if we want music
https://chat.whatsapp.com/FqjPaRrw3bnHP6gqUA9IAt,Thanks bb
You keen for golf soon? I want to start playing more,I don’t know if I have time for golf this semester is killing me already
Also my house is ready for braai time ,Sick
Possibly next weekend,Very keen
Same as last time or?,Yeah sounds good
Nah I’d rather not,Yeah fair 
I am seeing what I can do,You trying to find other people to play?
Can you and faith not just pay on the app that’s the only way it will work,Ok yeah will do
Photo,Dude so depressing… my dads surprise birthday is the same day 
Yea been good thanks and you ?,Yeah not too bad
It was going to be in the evening,damn sorry man
Yes we must. You busy this weekend?,unfortunetely yeah. but after tuesday ill be free for a bit
Okay sounds good braai at me on the Wednesday then?,very keen
Yea I am,"sick, how did they go?"
Okay then we can go then. So should we say meet at 4:50?,4:50 or 3:50?
Sorry.. trying hard over here to convince Emile that Bennies is just as good!,Goodluck!!
"What about the proofs that he said 
This theorem - with proof.",Yeah that’s what those 4 are. He only said theorem with proof for them. He didn’t mention proofs with any other theorems
Thanks a lot,Of course
"not dat sci 
I fall asleep 
The rest I’ve been good",lol well done
Where have you been,I gave up going to class
And it’s easy to hop on at any point,Fairs
And it’s easy to hop on at any point,Was thinking I should start going to it at some point
"no  and it feels daunting 
Today he was asking questions in class and I was just stunned",Have you started?
"You must 
It’s still at a chilled point",Okay okay…will try the next one
Have you started?,Noo
"Hi there - we can't wait to help you out!
Sometimes - usually if we have lots of clients needing us all at once - it takes us a little longer than we'd like to get a WhatsApp helper chatting to you.
We'd love to chat, but if at any time you don't need our help any more, please reply with CLOSE and we'll end this chat. We promise we wont take it personally.
Thanks for your patience!
Good day , how can I assist you today?","Hi, I have fibre network in newinbosch estate, stellenbosch and it is down"
"We apologize for any troubles caused , I will be with you shortly
Please confirm your ID number
Are you still there?
Thank you , I will be with you shortly
Are you still there?",Yes
"I understand you may need a bit more time to get back to me. Once you're ready to continue this chat, please message us back and we'll do our best to assist you.
Hi there - we can't wait to help you out!
Sometimes - usually if we have lots of clients needing us all at once - it takes us a little longer than we'd like to get a WhatsApp helper chatting to you.
We'd love to chat, but if at any time you don't need our help any more, please reply with CLOSE and we'll end this chat. We promise we wont take it personally.
Thanks for your patience!",Hi my fibre network is not working 
"Good Day, I hope you are well.
I apologize for the inconvenience caused.  Please hold while I locate your account. I will be with you shortly.
Please show me the lights on your fibre box?","All the lights on the fibre box are correct, the problem is with the router"
"Please unplug your ONT(fibre box) and router for at least 5 mins, I will then refresh your line. Please inform me when you have unplugged.",They are unplugged  thank you
"Thank you, please power back on at 09:12
Thank you for your patience. Please plug back in, give both devices up to 2 mins to power up and kindly test if you have internet.",Hi the router is still the same colour
"Okay no problem, let us troubleshoot further, do you have access to another phone or a laptop?",Yes
"Okay, please connect to the router WiFi on another device and open your web browser
On the web browser please type in tplinkwifi.net and hit search
If you are using another phone please ensure that mobile data is off
Are you still there?
Are you managing?","Hi thank the problem is sorted
Close"
"Do you have internet on your devices?
Do you need assistance with anything else at the moment?
Are you still there?",I’m all good thanks for the help
"nah
started",Where you?
"nice
sir
do you have an iron","Oh shit my bad
Hello
Why?"
"fuck
white tee
for dance","Shit
I have a non wrinkled one
If you want to borrow"
you good?,"Yeah
Didn’t want to walk in the rain"
fairs,You in class?
"what was the video that was clutch for symbol table
on youtube","Oh shit
Sorry didn’t see
Forgot what it was
Just search hash table implementation in c"
"bro
bro
i lost it",You going to comp sci?
"bro
you at the narga yet",Nah
"resources then documents i think
you find it?","yeah thanks bb
have you started?"
"yeah
i mean i finished off that codegen fe
file*
and then i’m busy w the stuff in simplc
hows it going w you",Shits low-key hard
"did this hun not give you sumn for chapter 1&2 of international fin
also are you going to dylans braai thin?",You?
"what did you do for financial markets
coz this textbook looking cheeks
feel like buying notes for fin markets chapter 1 & 2
is it bad?",I don’t really see how they gonna ask 40% of the paper on that
"i’m a uk9.5
i got that exact size in my birks","You writing?
I assume no
Since you not here"
"bro
put me on
i wanna start compsci. what you doing for it?
i feel like spreading it out and being nic level on top of my work","Past papers
That’s the way
Apparently
Just do as many as you can"
so slides then past papers?,Yebo
